Symbol,Name,SumWeights
KEYS,Keysight Technologies Inc. Common Stock,0.1152
FLTR.L,Flutter Entertainment PLC,0.11510000000000001
ENG.BC,Enagas SA,0.114899999
PTT-R,Ptt PCL DR,0.114700002
FORTUM,Fortum Oyj,0.114699998
SMPH,SM Prime Holdings Inc,0.1145
TWO,Two Harbors Investment Corp,0.114400002
SPTI,SPDR Portfolio Intermediate Ter,0.114300005
GMAB,Genmab A/S - American Depositary Shares,0.11430000000000001
MEL.NZ,Meridian Energy Ltd,0.114199996
SHL.DE,Siemens Healthineers AG Registered Shares,0.114100002
KNIN,Kuehne + Nagel International AG,0.113999998
HON22,NY Harbor ULSD Future June 22,0.113900006
MMC,"Marsh & McLennan Companies, Inc. Common Stock",0.11389999999999999
2615.TW,Wan Hai Lines Ltd,0.113699999
600276,Jiangsu Hengrui Pharmaceuticals Co Ltd,0.11349999599999999
KOTAKBANK.,Kotak Mahindra Bank Ltd,0.1134
002594,BYD Co Ltd Class A,0.113199999
ISP.MI,Intesa Sanpaolo,0.1127
SDY,SPDR S&P Dividend ETF,0.1122
02319,China Mengniu Dairy Co Ltd,0.1121
ITM.L,ITM Power PLC,0.11209999699999999
CP.TO,Canadian Pacific Railway Ltd,0.111900005
GBDC,"Golub Capital BDC, Inc. - Common Stock",0.111900005
ADSK,"Autodesk, Inc. - Common Stock",0.11190000029999998
BMRI,PT Bank Mandiri (Persero) Tbk,0.1118
ICE,Intercontinental Exchange Inc. Common Stock,0.1115
TSLX,"Sixth Street Specialty Lending, Inc. Common Stock",0.111100002
NVAX,"Novavax, Inc. - Common Stock",0.11089999980000001
PNCPP,PNC Financial Services Group Inc Perpetual Preferred Share class-P,0.110899999
01093,CSPC Pharmaceutical Group Ltd,0.11089999599999999
ISD,"PGIM High Yield Bond Fund, Inc.",0.1108000005
LMND,"Lemonade, Inc. Common Stock",0.1107
01024,Kuaishou Technology Ordinary Shares - Class B,0.110599999
DG.PA,Vinci SA,0.1105
NRZ,New Residential Investment Corp. Common Stock,0.1104
XMLV,Invesco S&P MidCap Low Volatili,0.11019999999999999
UFS,Domtar Corporation (NEW) Common Stock,0.1101
GVAL,Cambria Global Value ETF,0.11
VYGR,"Voyager Therapeutics, Inc. - Common Stock",0.10999999999999999
SWBI,"Smith & Wesson Brands, Inc. - Common Stock",0.1099
TLKM,PT Telkom Indonesia (Persero) Tbk Class B,0.1099
BRNH22,Brent Crude Future Jan 22,0.109799996
KKR,KKR & Co. Inc. Common Stock,0.109700002
PRU,"Prudential Financial, Inc. Common Stock",0.10959999999999999
VMW,"Vmware, Inc. Common stock, Class A",0.10959999999999999
PBTP,Invesco PureBeta 0-5 Yr US TIPS,0.1094
01113.HK,CK Asset Holdings Ltd,0.1091999995
SGMS,Scientific Games Corp - Common Stock,0.10909999960000001
SAMPO,Sampo Oyj Class A,0.108900005
UDR,"UDR, Inc. Common Stock",0.1089
GGG,Graco Inc. Common Stock,0.1088999995
COPEC,Empresas COPEC SA,0.10880000000000001
CM.TO,Canadian Imperial Bank of Commerce,0.108600002
LIT,Global X Lithium & Battery Tech,0.1086
ITX.BC,Industria De Diseno Textil SA,0.108499999
01177.HK,Sino Biopharmaceutical Ltd,0.108300001
DBX,"Dropbox, Inc. - Class A Common Stock",0.10829999799999998
BF.B,Brown Forman Inc Class B Common Stock,0.10819999999999999
TCL.AX,Transurban Group,0.10819999999999999
LYFT,"Lyft, Inc. - Class A Common Stock",0.10809999700000002
COLD,Americold Realty Trust Common Shares,0.108
WMS,"Advanced Drainage Systems, Inc. Common Stock",0.1078
STOR,STORE Capital Corporation Common Stock,0.10769999799999999
HASI,"Hannon Armstrong Sustainable Infrastructure Capital, Inc. Common Stock",0.1075
FATE,"Fate Therapeutics, Inc. - Common Stock",0.1074
EDPR.BC,EDP Renovaveis SA,0.107399998
SCHE,Schwab Emerging Markets Equity ,0.1073
JBHT,"J.B. Hunt Transport Services, Inc. - Common Stock",0.10729999700000001
PSFM,Pacer Swan SOS Flex (April) ETF,0.107200004
UTHR,United Therapeutics Corporation - Common Stock,0.1071999997
RGEN,Repligen Corporation - Common Stock,0.10719999699999999
SWN,Southwestern Energy Company Common Stock,0.10700000000000001
NEO,"NeoGenomics, Inc. - Common Stock",0.1068
01109,China Resources Land Ltd,0.1064
PCG,Pacific Gas & Electric Co. Common Stock,0.10629999899999999
SCZ,iShares MSCI EAFE Small-Cap ETF,0.1062
STLA,Stellantis N.V. Common Shares,0.1061
EUROB,Eurobank Ergasias Services And Holdings SA,0.106000006
UBER,"Uber Technologies, Inc. Common Stock",0.1059
U.TO,Uranium Participation Corp,0.10589999900000001
CFR,"Cullen/Frost Bankers, Inc. Common Stock",0.1057
TSCO,Tractor Supply Company - Common Stock,0.10569999999999999
AAP,Advance Auto Parts Inc Advance Auto Parts Inc W/I,0.10549999900000001
09618,JD.com Inc Ordinary Shares - Class A,0.1054
SPLV,Invesco S&P 500 Low Volatility ,0.10519999999999999
XSLV,Invesco S&P SmallCap Low Volati,0.105100003
PAYX,"Paychex, Inc. - Common Stock",0.1050999985
BTO.TO,B2Gold Corp,0.10500000000000001
CONE,CyrusOne Inc - Common Stock,0.105
EMR,Emerson Electric Company Common Stock,0.104799999
IMP.JO,Impala Platinum Holdings Ltd,0.104799998
PKO,Pimco Income Opportunity Fund Common Shares of Beneficial Interest,0.10479999
IJGXX,JPMorgan US Government MMkt Instl,0.10479999
DBO,Invesco DB Oil Fund,0.1047
XLU,SPDR Select Sector Fund - Utili,0.104399994
IFF,"Internationa Flavors & Fragrances, Inc. Common Stock",0.10420000000000001
JOAXX,JPMorgan Instl Tx Fr Mny Mkt Agcy,0.1042
ORLY,"O'Reilly Automotive, Inc. - Common Stock",0.10410000300000001
1155,Malayan Banking Bhd,0.10400000000000001
051910.KS,LG Chem Ltd,0.10399999999999998
HPG,Hoa Phat Group JSC,0.1039
IJT,iShares S&P Small-Cap 600 Growt,0.1038
CYBR,CyberArk Software Ltd. - Ordinary Shares,0.10369999899999999
CHK,Chesapeake Energy Corporation - Common Stock,0.1035999958
6702,Fujitsu Ltd,0.10350000000000001
MGK,Vanguard Mega Cap Growth ETF,0.1035
ALKS,Alkermes plc - Ordinary Shares,0.10349999800000001
YAR,Yara International ASA,0.1034
ZURN,Zurich Insurance Group AG,0.103399998
ALE,"Allete, Inc.",0.103300005
TESXU1,EURO STOXX 50 Index Total Return Sept21,0.1033
UNFI,"United Natural Foods, Inc. Common Stock",0.1032
CHUY,"Chuy's Holdings, Inc. - Common Stock",0.103199997
IYH,iShares U.S. Healthcare ETF,0.103199996
EDU,"New Oriental Education & Technology Group, Inc. Sponsored ADR representing 1 Ordinary Share (Cayman Islands)",0.10290000299999999
PNQI,Invesco Nasdaq Internet ETF,0.1029
NS,Nustar Energy L.P.  Common Units,0.1028
NXE.TO,NexGen Energy Ltd,0.102600004
01772,Ganfeng Lithium Co Ltd,0.102599998
VGIT,Vanguard Intermediate-Term Trea,0.10239999899999999
SOCL,Global X Social Media ETF,0.102
PGHN,Partners Group Holding AG,0.101999997
SMED,Sharps Compliance Corp. - Common Stock,0.1019
PSCX,Pacer Swan SOS Conservative (De,0.1019
VEDL.BO,Vedanta Ltd ADR,0.10189999999999999
RIOT,"Riot Blockchain, Inc - Common Stock",0.1018999997
EPAM,"EPAM Systems, Inc. Common Stock",0.10179999919999999
00270,Guangdong Investment Ltd,0.101699999
QRVO,"Qorvo, Inc. - Common Stock",0.101600004
VIS,Vanguard Industrials ETF,0.1016
SPXL,Direxion Daily S&P 500 Bull 3X ,0.1016
ATH,Athene Holding Ltd. Class A Common Shares,0.1014
KOMP,SPDR S&P Kensho New Economies C,0.1013
UPRO,ProShares UltraPro S&P 500,0.1012
MDKA,PT Merdeka Copper Gold Tbk,0.10119999799999999
FYX,First Trust Small Cap Core Alph,0.1011
EMIRATESNB,Emirates NBD PJSC,0.1011
AKAM,"Akamai Technologies, Inc. - Common Stock",0.101000002
ONEX.TO,Onex Corp,0.10100000029999999
WEC,"WEC Energy Group, Inc. Common Stock",0.1007000005
BEP.UN,Brookfield Renewable Partners LP,0.10070000000000001
2412.TW,Chunghwa Telecom Co Ltd,0.10070000000000001
688111,Beijing Kingsoft Office Software Inc Class A,0.100600004
ASII,PT Astra International Tbk,0.1006
SPYG,SPDR Series Trust SPDR Portfoli,0.100400002
SX1,Soybean Nov21,0.1003
BBL.L,BHP Group PLC ADR,0.1003
532977.BO,Bajaj Auto Ltd,0.1002
2010,Saudi Basic Industries Corp,0.1001
GMKN,Mining and Metallurgical Company NORILSK NICKEL PJSC,0.100000002
NSTL,Nestle Nigeria PLC,0.1
SLAB,"Silicon Laboratories, Inc. - Common Stock",0.09999999820000001
BHP.L,BHP Group PLC,0.099999998
BCPC,Balchem Corporation - Common Stock,0.099900005
FTSM,First Trust Enhanced Short Matu,0.0999
UCON,First Trust TCW Unconstrained P,0.0999
SLQD,iShares 0-5 Year Investment Gra,0.0999
ARI,"Apollo Commercial Real Estate Finance, Inc",0.09989999999999999
WST,"West Pharmaceutical Services, Inc. Common Stock",0.09979999850000001
00688,China Overseas Land & Investment Ltd,0.0997
FRC,FIRST REPUBLIC BANK Common Stock,0.09950000199999999
PTEN,"Patterson-UTI Energy, Inc. - Common Stock",0.0995000002
IGSB,iShares 1-5 Year Investment Gra,0.0995
RVLV,"Revolve Group, Inc. Class A Common Stock",0.0994000015
YPS,Arrow Reverse Cap 500 ETF,0.099300005
OPAP,Greek Organisation of Football Prognostics SA,0.099300005
ENTG,"Entegris, Inc. - Common Stock",0.0992999992
ARDC,"Ares Dynamic Credit Allocation Fund, Inc. Common Shares",0.09920000000000001
ZFU1,Us 5yr Note (Cbt) Sep21 Xcbt 20210930,0.099
EBND,SPDR Bloomberg Barclays Emergin,0.099
AR,Antero Resources Corporation Common Stock,0.09889999950000002
TOU.TO,Tourmaline Oil Corp,0.09870000100000001
CFG,"Citizens Financial Group, Inc. Common Stock",0.09860000099999999
POWI,"Power Integrations, Inc. - Common Stock",0.0985999988
OSK,Oshkosh Corporation (Holding Company)Common Stock,0.09850000279999999
06969.HK,Smoore International Holdings Ltd Ordinary Shares,0.0984
DSY.PA,Dassault Systemes SE,0.098399999
ELS,"Equity Lifestyle Properties, Inc. Common Stock",0.098399997
OMF,"OneMain Holdings, Inc. Common Stock",0.098300003
INVH,Invitation Homes Inc. Common Stock,0.0983
PII,Polaris Inc. Common Stock,0.09820000000000001
000651,Gree Electric Appliances Inc of Zhuhai,0.09819999800000001
WBC.AX,Westpac Banking Corp,0.0981
600887,Inner Mongolia Yili Industrial Group Co Ltd,0.09809999999999999
SBRA,"Sabra Health Care REIT, Inc. - Common Stock",0.098
AKZA,Akzo Nobel NV,0.097999997
ARKF,ARK Fintech Innovation ETF,0.09770001
ITRI,"Itron, Inc. - Common Stock",0.0977
FNX,First Trust Mid Cap Core AlphaD,0.09729999
PBR.SA,Petroleo Brasileiro SA Petrobras ADR,0.0972
GFI.JO,Gold Fields Ltd,0.09719999700000001
K,Kellogg Company Common Stock,0.09709999999999999
SJI,"South Jersey Industries, Inc. Common Stock",0.0969
LDOS,"Leidos Holdings, Inc. Common Stock",0.09689999799999999
BLNK,Blink Charging Co. - Common Stock,0.09689999
JEF,Jefferies Financial Group Inc. Common Stock,0.096799999
TME,"Tencent Music Entertainment Group American Depositary Shares, each representing two Class A Ordinary Shares",0.096699998
SEE,Sealed Air Corporation Common Stock,0.09650000079999999
PENN,"Penn National Gaming, Inc. - Common Stock",0.09649999999999999
TER,"Teradyne, Inc. - Common Stock",0.0964
ARW,"Arrow Electronics, Inc. Common Stock",0.0963999991
CLF,Cleveland-Cliffs Inc. Common Stock,0.096
ARKG,ARK Genomic Revolution ETF,0.096
OLN,Olin Corporation Common Stock,0.095999999
CWR.L,Ceres Power Holdings PLC,0.095999997
RYN,Rayonier Inc. REIT Common Stock,0.0959999938
FXY,Invesco CurrencyShares Japanese,0.0958
TPX,"Tempur Sealy International, Inc. Common Stock",0.09570000000000001
STAG,"Stag Industrial, Inc. Common Stock",0.09570000000000001
VIOV,Vanguard S&P Small-Cap 600 Valu,0.095699996
LUCK,Lucky Cement Ltd,0.0955
DPH.L,Dechra Pharmaceuticals PLC,0.09530000450000001
LPX,Louisiana-Pacific Corporation Common Stock,0.0952000003
NCM.AX,Newcrest Mining Ltd,0.095100004
FICO,Fair Isaac Corproation Common Stock,0.0951000011
HCLTECH.BO,HCL Technologies Ltd Shs Dematerialised,0.09489999899999998
SNV,Synovus Financial Corp. Common Stock,0.0947999972
CEZ,CEZ a.s,0.094700003
CAG,"ConAgra Brands, Inc. Common Stock",0.0946999985
ALLYPA,GMAC Capital Trust I Pfd Secs 2011-15.2.40 Gtd Series 2,0.094600002
AVY,Avery Dennison Corporation Common Stock,0.09459999799999999
MMU,"Western Asset Managed Municipals Fund, Inc. Common Stock",0.0945
FLGT,"Fulgent Genetics, Inc. - Common Stock",0.094499998
UVV,Universal Corporation Common Stock,0.09449999799999999
SSLY,Syntax Stratified SmallCap ETF,0.094499996
NHY,Norsk Hydro ASA,0.0944
PCTY,Paylocity Holding Corporation - Common Stock,0.09439999900000001
VDE,Vanguard Energy ETF,0.094299998
DOX,Amdocs Limited - Ordinary Shares,0.0942
AMH,American Homes 4 Rent Common Shares of Beneficial Interest,0.0942
MAIN,Main Street Capital Corporation Common Stock,0.0941
MET,"MetLife, Inc. Common Stock",0.0941
PGF,Invesco Financial Preferred ETF,0.0941
600309,Wanhua Chemical Group Co Ltd,0.09409999699999999
SUI,"Sun Communities, Inc. Common Stock",0.093999997
CVNA,Carvana Co. Class A Common Stock,0.093800001
AIA.NZ,Auckland International Airport Ltd,0.0938
NDAQ,"Nasdaq, Inc. - Common Stock",0.0937
RTYU21,E-mini Russell 2000 Index Future Sept 21,0.093600005
BPMP,BP Midstream Partners LP Common Units representing Limited Partner Interests,0.0936
VHM,Vinhomes JSC,0.09359999899999999
TRNFP,Transneft PJSC Participating Preferred,0.09340000600000001
BXMT,"Blackstone Mortgage Trust, Inc. Common Stock",0.09340000000000001
NZF,Nuveen Municipal Credit Income Fund ,0.0933
CCEP.L,Coca-Cola Europacific Partners PLC,0.093299998
YMH21,E-mini Dow $5 Future Mar 21,0.093
CTT,"CatchMark Timber Trust, Inc. Class A Common Stock",0.0929
CSGP,"CoStar Group, Inc. - Common Stock",0.092899999
VMC,Vulcan Materials Company (Holding Company) Common Stock,0.092799999
01088,China Shenhua Energy Co Ltd Class H,0.0925
IPG,"Interpublic Group of Companies, Inc. (The) Common Stock",0.0924999993
SK3.IR,Smurfit Kappa Group PLC,0.092499998
RNG,"RingCentral, Inc. Class A Common Stock",0.0924
OLED,Universal Display Corporation - Common Stock,0.092300002
SMSN.KS,Samsung Electronics Co Ltd GDR,0.092099998
BCE.TO,BCE Inc,0.092000001
BIMAS,Bim Birlesik Magazalar AS,0.092
BNP.PA,BNP Paribas,0.091699995
WDFC,WD-40 Company - Common Stock,0.0916
OMI,"Owens & Minor, Inc. Common Stock",0.0915
INFXX,Franklin IFT Money Market,0.091499999
SIG,Signet Jewelers Limited Common Shares,0.09130000070000001
FAF,First American Corporation (New) Common Stock,0.0912
KBC,KBC Group SA/NV,0.0911
LUMN,"Lumen Technologies, Inc. Common Stock",0.0909
BURL,"Burlington Stores, Inc. Common Stock",0.09080000079999999
603799,Zhejiang Huayou Cobalt Co Ltd,0.0907
00027.HK,Galaxy Entertainment Group Ltd,0.090699998
EVO,Evolution AB,0.0905
JAZZ,Jazz Pharmaceuticals plc - Ordinary Shares,0.090499998
HSKA,Heska Corporation - Common Stock,0.090100003
CQP,"Cheniere Energy Partners, LP Cheniere Energy Partners, LP Common Units",0.0901
IGIB,iShares 5-10 Year Investment Gr,0.09
FISV,"Fiserv, Inc. - Common Stock",0.08979999999999999
WRK,Westrock Company Common Stock,0.089599997
00291,China Resources Beer (Holdings) Co Ltd,0.089499995
BSCL,Invesco BulletShares 2021 Corpo,0.089499995
ALI,Ayala Land Inc,0.089499995
PKX.KS,POSCO ADR,0.089400001
AMED,Amedisys Inc - Common Stock,0.08939999700000001
CPZ,Calamos Long/Short Equity & Dynamic Income Trust - Common Stock,0.08939999
PAWZ,ProShares Pet Care ETF,0.0892
000270.KS,Kia Corp,0.08909999900000001
AENA.BC,Aena SME SA,0.089
ONLN,ProShares Online Retail ETF,0.088999994
WIT.BO,Wipro Ltd ADR,0.088900001
SOF,Sofina SA,0.08890000029999999
SPSB,SPDR Portfolio Short Term Corpo,0.088800001
MTNN,MTN Nigeria Communications PLC Ordinary Shares,0.08879999999999999
SCC-R,Siam Cement PCL Units Non-Voting Depository Receipt,0.0887
DIVISLAB.B,Divi's Laboratories Ltd,0.0887
BMI,"Badger Meter, Inc. Common Stock",0.088599998
CHWY,"Chewy, Inc. Class A Common Stock",0.0885
MRW.L,Morrison (Wm) Supermarkets PLC,0.0884999996
GEB,Grupo Energia Bogota SA ESP,0.088499997
VTV,Vanguard Value ETF,0.08829999799999999
FLL,"Full House Resorts, Inc. - Common Stock",0.088200002
DWX,SPDR S&P International Dividend,0.088199995
TRUP,"Trupanion, Inc. - Common Stock",0.08799999750000001
RHI,Robert Half International Inc. Common Stock,0.087900002
6954,Fanuc Corp,0.0879
RICK,"RCI Hospitality Holdings, Inc. - Common Stock",0.087800002
NUTRESA,Grupo Nutresa SA,0.087799996
RIO.AX,Rio Tinto Ltd,0.0877
IVN.TO,Ivanhoe Mines Ltd A,0.08750000299999999
EW,Edwards Lifesciences Corporation Common Stock,0.0875
MAV,"Pioneer Municipal High Income Advantage Fund, Inc.",0.0875
PNFP,"Pinnacle Financial Partners, Inc. - Common Stock",0.087400002
TAEE11.SA,Transmissora Alianca de Energia Eletrica SA Unit,0.08740000099999999
CLX,Clorox Company (The) Common Stock,0.0873999995
AEM.TO,Agnico Eagle Mines Ltd,0.087199998
AAL.L,Anglo American PLC,0.0871
EFG,iShares MSCI EAFE Growth ETF,0.0871
POTX,Global X Cannabis ETF,0.087
SEV.PA,Suez SA,0.086900003
FOXA,Fox Corporation - Class A Common Stock,0.08689999649999999
ORK,Orkla ASA,0.0868
GGAL,"Grupo Financiero Galicia S.A. - American Depositary Shares, Class B Shares underlying",0.0867
ERII,"Energy Recovery, Inc. - Common Stock",0.0865
CBSH,"Commerce Bancshares, Inc. - Common Stock",0.086400004
NQH21,E-mini Nasdaq 100 Future Mar 21,0.0864
RH,RH Common Stock,0.08629999999999999
AMBA.TW,Ambarella Inc,0.08620000000000001
MNDI.L,Mondi PLC,0.0862
CNC,Centene Corporation Common Stock,0.0861999993
BFAM,Bright Horizons Family Solutions Inc. Common Stock,0.0861
FNDE,Schwab Fundamental Emerging Mar,0.0861
YPF,YPF Sociedad Anonima Common Stock,0.0859
ATO,Atmos Energy Corporation Common Stock,0.0859
SDAZ5,S&P 500 Annual Dividend Index Dec25,0.08579999999999999
PNW,Pinnacle West Capital Corporation Common Stock,0.085699998
LBRDK,Liberty Broadband Corporation - Class C Common Stock,0.08569999780000001
TLEVISACPO,Grupo Televisa SAB,0.0856
PWR,"Quanta Services, Inc. Common Stock",0.0854999996
CSNA3.SA,Companhia Siderurgica Nacional,0.08510000000000001
SDAZ4,S&P 500 Annual Dividend Index Dec24,0.08510000000000001
TIPX,SPDR Bloomberg Barclays 1-10 Ye,0.0851
BXMX,Nuveen S&P 500 Buy-Write Income Fund Common Shares of Beneficial Interest,0.085099999
LVMUY.PA,LVMH Moet Hennessy Louis Vuitton SE ADR,0.085000001
FFC,Flaherty & Crumrine Preferred and Income Securities Fund Incorporated,0.08499999999999999
PDN.AX,Paladin Energy Ltd,0.084999999
APPN,Appian Corporation - Class A Common Stock,0.08490000169999999
CDNA,"CareDx, Inc. - Common Stock",0.0849
FEYE,"FireEye, Inc. - Common Stock",0.0847
UMI,USCF Midstream Energy Income Fu,0.08460000000000001
AGR,"Avangrid, Inc. Common Stock",0.0842
TCS,Container Store (The) Common Stock,0.0842
FCNCA,"First Citizens BancShares, Inc. - Class A Common Stock",0.084199997
IPO,Renaissance IPO ETF,0.0841
096770.KS,SK Innovation Co Ltd,0.08380000000000001
531642.BO,Marico Ltd,0.08380000000000001
DJUN,FT Cboe Vest U.S. Equity Deep B,0.0838
PAPR,Innovator U.S. Equity Power Buf,0.0838
SSPK,Silver Spike Acquisition Corp Ordinary Shares Class A,0.0838
DAPR,FT Cboe Vest U.S. Equity Deep B,0.0837
PMAY,Innovator U.S. Equity Power Buf,0.0837
00392,Beijing Enterprises Holdings Ltd,0.0837
8802,Mitsubishi Estate Co Ltd,0.08360000000000001
ORCC,Owl Rock Capital Corporation Common Stock,0.0836
DMAR,FT Cboe Vest U.S. Equity Deep B,0.0836
DMAY,FT Cboe Vest U.S. Equity Deep B,0.0836
PMAR,Innovator U.S. Equity Power Buf,0.0836
UU..L,United Utilities Group PLC,0.08359999900000001
DFEB,FT Cboe Vest U.S. Equity Deep B,0.083500005
DJAN,FT Cboe Vest U.S. Equity Deep B,0.083500005
PJAN,Innovator U.S. Equity Power Buf,0.083500005
PFEB,Innovator U.S. Equity Power Buf,0.083500005
DOCT,FT Cboe Vest U.S. Equity Deep B,0.0834
PSEP,Innovator U.S. Equity Power Buf,0.0834
PDEC,Innovator U.S. Equity Power Buf,0.0834
AGRO.SA,Adecoagro SA,0.0833
DDEC,FT Cboe Vest U.S. Equity Deep B,0.0833
SDAZ3,S&P 500 Annual Dividend Index Dec23,0.0833
PJUN,Innovator U.S. Equity Power Buf,0.0832
POCT,Innovator U.S. Equity Power Buf,0.0832
PSON.L,Pearson PLC,0.0832
DAUG,FT Cboe Vest U.S. Equity Deep B,0.083100006
PNOV,Innovator U.S. Equity Power Buf,0.083100006
CWT,California Water Service Group Common Stock,0.083100006
DNOV,FT Cboe Vest U.S. Equity Deep B,0.083000004
TCEHY,Tencent Holdings Ltd ADR,0.083000004
2609.TW,Yang Ming Marine Transport Corp,0.08299999999999999
JNPR,"Juniper Networks, Inc. Common Stock",0.0828999995
300142,Walvax Biotechnology Co Ltd,0.0828
00268,Kingdee International Software Group Co Ltd,0.0828
03988,Bank Of China Ltd Class H,0.082799995
9020,East Japan Railway Co,0.082700002
00836,China Resources Power Holdings Co Ltd,0.0827
HTRB,Hartford Total Return Bond ETF,0.082600005
NAB.AX,National Australia Bank Ltd,0.0826
NUS,"Nu Skin Enterprises, Inc. Common Stock",0.0825
SCHC,Schwab International Small-Cap ,0.0825
PEO,"Adams Natural Resources Fund, Inc. Common Stock",0.08249999799999999
LOGN,Logitech International SA,0.08249999599999999
02007,Country Garden Holdings Co Ltd,0.08230000000000001
JMAT.L,Johnson Matthey PLC,0.0822
GPN,Global Payments Inc. Common Stock,0.082100002
GSBD,"Goldman Sachs BDC, Inc. Common Stock",0.08200000299999999
STRL,Sterling Construction Company Inc - Common Stock,0.0818
IQV,"IQVIA Holdings, Inc. Common Stock",0.0816999995
DSKY,Detskymir PJSC,0.08140001
WH,"Wyndham Hotels & Resorts, Inc. Common Stock ",0.081400002
SDAZ2,S&P 500 Annual Dividend Index Dec22,0.0814
00788,China Tower Corp Ltd Ordinary Shares - Class H,0.08130000000000001
DML.TO,Denison Mines Corp,0.08130000000000001
SRPT,"Sarepta Therapeutics, Inc. - Common Stock",0.081200002
BHARTIARTL,Bharti Airtel Ltd,0.081199998
JJSF,J & J Snack Foods Corp. - Common Stock,0.081099997
SVT.L,Severn Trent PLC,0.081000003
01801,Innovent Biologics Inc,0.081
MAC,Macerich Company (The) Common Stock,0.0809999988
06186,China Feihe Ltd Ordinary Shares,0.08080000000000001
MP,MP Materials Corp. Common Stock,0.0808
603501,Will Semiconductor Co Ltd Shanghai,0.080699995
OGZD,Gazprom PJSC ADR,0.080699995
KINV B,Kinnevik AB B,0.0805000003
SRU.UN.TO,SmartCentres Real Estate Investment Trust Trust Units Variable Voting,0.080400001
SRG.MI,Snam SpA,0.0803000005
LXFR.L,Luxfer Holdings PLC,0.08029999900000001
IBN.BO,ICICI Bank Ltd ADR,0.0802
SSA,Sistema PJSFC GDR,0.0802
EREGL,Eregli Demir Ve Celik Fabrikalari TAS,0.0802
XPO,"XPO Logistics, Inc.",0.0801000006
WFCPQ,Wells Fargo & Co Deposit Shs Repr 1/1000th 5.85 % Non-Cum Perp Pfd Shs -A-,0.080000002
300014,EVE Energy Co Ltd,0.0799
NNN,National Retail Properties Common Stock,0.0799
HTGC,"Hercules Capital, Inc. Common Stock",0.0797
603288,Foshan Haitian Flavouring and Food Co Ltd Class A,0.0797
ANET,"Arista Networks, Inc. Common Stock",0.079599999
STERV,Stora Enso Oyj Class R,0.079500001
KREF,KKR Real Estate Finance Trust Inc. Common Stock,0.0795
FWONK,Liberty Media Corporation - Series C Liberty Formula One Common Stock,0.0795
XEC,Cimarex Energy Co Common Stock,0.079499996
CRDA.L,Croda International PLC,0.079399999
ZENITH,Zenith Bank PLC,0.0793
MCY.NZ,Mercury NZ Ltd,0.07920000299999999
SJR.B.TO,Shaw Communications Inc Class B,0.07919999999999999
GH,"Guardant Health, Inc. - Common Stock",0.0791
BV,"BrightView Holdings, Inc. Common Stock",0.0791
507685.BO,Wipro Ltd,0.0791
TITAN.BO,Titan Co Ltd,0.0791
OPI,Office Properties Income Trust - Common Shares of Beneficial Interest,0.0791
FIGXX,Fidelity® Inv MM Fds Government I,0.0788999995
PFDAVVNDA,Banco Davivienda SA Participating Preferred,0.0788
EMD,Western Asset Emerging Markets Debt Fund Inc Common Stock,0.0788
00175,Geely Automobile Holdings Ltd,0.0787
PMT,PennyMac Mortgage Investment Trust Common Shares of Beneficial Interest,0.0787
ZTO,"ZTO Express (Cayman) Inc. American Depositary Shares, each representing one Class A ordinary share.",0.078600004
DPZ,Domino's Pizza Inc Common Stock,0.0785
000568,Luzhou Laojiao Co Ltd,0.0785
EXPO,"Exponent, Inc. - Common Stock",0.078499999
MT.SA,ArcelorMittal SA,0.0784
500825.BO,Britannia Industries Ltd,0.078200005
WPC,W. P. Carey Inc. REIT,0.078200005
AMS.TW,ams AG,0.07819999999999999
SMLR,Semler Scientific Inc,0.0781
TMDX,"TransMedics Group, Inc. - Common Stock",0.078099999
NYCB,"New York Community Bancorp, Inc. Common Stock",0.078099996
TRV,"The Travelers Companies, Inc. Common Stock",0.078
AMCX,AMC Networks Inc. - Class A Common Stock,0.07799999999999999
AMKR,"Amkor Technology, Inc. - Common Stock",0.07799999999999999
SEM,Select Medical Holdings Corporation Common Stock,0.077999999
U11.SI,United Overseas Bank Ltd,0.077999995
SIL.TO,SilverCrest Metals Inc,0.077900003
000333,Midea Group Co Ltd Class A,0.077900002
VOT,Vanguard Mid-Cap Growth ETF,0.077800006
AMRS,"Amyris, Inc. - Common Stock",0.07769999999999999
BMRN,BioMarin Pharmaceutical Inc. - Common Stock,0.07769999799999999
GNL,"Global Net Lease, Inc. Common Stock",0.0776
BVN,Buenaventura Mining Company Inc.,0.077399998
VRSN,"VeriSign, Inc. - Common Stock",0.0773000003
NHI,"National Health Investors, Inc. Common Stock",0.0773
ATW,Attijariwafa Bank SA Registered Shares,0.077200001
KSS,Kohl's Corporation Common Stock,0.077200001
MDP,Meredith Corporation Common Stock,0.07719999799999999
HXL,Hexcel Corporation Common Stock,0.077100002
1925,Daiwa House Industry Co Ltd,0.0771000005
VLUE,iShares MSCI USA Value Factor E,0.077
NRG,"NRG Energy, Inc. Common Stock",0.0769
PKN,Polski Koncern Naftowy ORLEN SA,0.0767999995
ESPO,VanEck Video Gaming and eSports,0.076799996
URW.PA,Unibail-Rodamco-Westfield,0.076600004
MSGS,Madison Square Garden Sports Corp. Class A Common Stock (New),0.0766
PHIA,Koninklijke Philips NV,0.076500002
MXI,iShares Global Materials ETF,0.0765
STAA,STAAR Surgical Company - Common Stock,0.0764999998
VIV.PA,Vivendi SA,0.076499997
ANZ.AX,Australia and New Zealand Banking Group Ltd,0.076400002
IAM,Maroc Telecom SA,0.0764
CU1,Corn Sept21,0.0763
ERJ.SA,Embraer SA ADR,0.07629999999999999
VNM,VanEck Vietnam ETF,0.0762
FUTR.L,Future PLC,0.076000004
PBCT,"People's United Financial, Inc. - Common Stock",0.076000001
00960,Longfor Group Holdings Ltd,0.076
MNST,Monster Beverage Corporation - Common Stock,0.075800002
CHPT,"ChargePoint Holdings, Inc. Common Stock",0.07580000099999999
EAST.CA,Eastern Co SAE,0.0757
INGR,Ingredion Incorporated Common Stock,0.07569999999999999
NMFC,New Mountain Finance Corporation - Common Stock,0.07569999599999999
AGO,Assured Guaranty Ltd. Common Stock,0.0755000011
01044,Hengan International Group Co Ltd,0.075499999
VALMT,Valmet Corp,0.0754
HLMA.L,Halma PLC,0.0753
PERI,Perion Network Ltd - Ordinary Shares,0.0753
CNXC,Concentrix Corporation - Common Stock,0.075200001
DSL,DoubleLine Income Solutions Fund Common Shares of Beneficial Interests,0.075
CLR,"Continental Resources, Inc. Common Stock",0.0749999995
ANF,Abercrombie & Fitch Company Common Stock,0.0749999988
ANDINA-B,Embotelladora Andina SA Participating Preferred,0.0749
